{
  "format_version": 1,
  "platform": "nx",
  "title_id": "0100000000010000",
  "save_type": "savedata",
  "version": 0,
  "parent_version": null,
  "sha256": "e3b0c44298fc1c149afbf4c8996fb92427ae41e4649b934ca495991b7852b855",
  "size": 0,
  "device_label": "리빙룸 스위치",
  "created_at": "1970-01-01T00:00:00Z"
}
